{
  "$schema": "https://json-schema.org/draft/2020-12/schema",
  "$id": "https://openphone.dev/schemas/agent-job.schema.json",
  "title": "OpenPhone Agent Job",
  "type": "object",
  "required": [
    "id",
    "type",
    "title",
    "prompt",
    "payload_json",
    "schedule_json",
    "session_target",
    "delivery_json",
    "status",
    "created_at",
    "updated_at",
    "next_run_at",
    "running_at",
    "last_run_at",
    "last_result",
    "failure_count",
    "failure_alert_at",
    "phase",
    "progress_text",
    "progress_current",
    "progress_total",
    "checkpoint_json",
    "pending_confirmation_id",
    "pending_tool_request_json",
    "last_surface_id",
    "resume_token",
    "last_event_at",
    "unread_result",
    "paused_at"
  ],
  "properties": {
    "id": { "type": "integer", "minimum": 1 },
    "type": {
      "enum": ["agent_turn", "system_event", "heartbeat"]
    },
    "title": { "type": "string", "minLength": 1 },
    "prompt": { "type": "string" },
    "payload_json": { "type": "object" },
    "schedule_json": { "type": "object" },
    "session_target": { "type": "string" },
    "delivery_json": {
      "type": "object",
      "properties": {
        "mode": {
          "enum": ["notification", "silent", "none"]
        },
        "notification_text": {
          "type": "string"
        }
      },
      "additionalProperties": true
    },
    "status": {
      "enum": [
        "active",
        "queued",
        "running",
        "waiting",
        "awaiting_review",
        "paused",
        "completed",
        "failed",
        "stopped",
        "dispatched"
      ]
    },
    "created_at": { "type": "integer", "minimum": 0 },
    "updated_at": { "type": "integer", "minimum": 0 },
    "next_run_at": { "type": "integer", "minimum": 0 },
    "running_at": { "type": "integer", "minimum": 0 },
    "last_run_at": { "type": "integer", "minimum": 0 },
    "last_result": { "type": "string" },
    "failure_count": { "type": "integer", "minimum": 0 },
    "failure_alert_at": { "type": "integer", "minimum": 0 },
    "phase": { "type": "string", "maxLength": 120 },
    "progress_text": { "type": "string", "maxLength": 4000 },
    "progress_current": { "type": "integer", "minimum": 0 },
    "progress_total": { "type": "integer", "minimum": 0 },
    "checkpoint_json": { "type": "object" },
    "pending_confirmation_id": { "type": "string", "maxLength": 200 },
    "pending_tool_request_json": { "type": "object" },
    "last_surface_id": { "type": "string", "maxLength": 160 },
    "resume_token": { "type": "string", "maxLength": 200 },
    "last_event_at": { "type": "integer", "minimum": 0 },
    "unread_result": { "type": "boolean" },
    "paused_at": { "type": "integer", "minimum": 0 }
  },
  "additionalProperties": false
}
